{
  "id": "BS01-RU-006",
  "name": "????",
  "faction": "??",
  "rarity": "epic",
  "type": "spell",
  "cost": 2,
  "rules_text": "????1?????????2??",
  "keyword_ids": [
    "??"
  ],
  "mechanic_ids": [
    "MEC-CORE-DRAW",
    "MEC-CORE-DEFENSE"
  ],
  "lore_anchor_ids": [
    "ANC-FACTION-002",
    "ANC-CONTENT-002"
  ],
  "provenance": {
    "batch_id": "BATCH-20260322-10",
    "models_used": [
      "Codex"
    ],
    "canon_version": "0.1.0",
    "seed": "20260322-10"
  },
  "status": "draft"
}
