{
  "id": "BS01-RU-005",
  "name": "司史执笔",
  "faction": "儒家",
  "rarity": "rare",
  "type": "minion",
  "cost": 3,
  "rules_text": "施加【怀疑+1】；获得【护持2】。",
  "keyword_ids": [
    "怀疑",
    "护持"
  ],
  "mechanic_ids": [
    "MEC-CORE-ORDER",
    "MEC-CORE-COUNTER"
  ],
  "lore_anchor_ids": [
    "ANC-FACTION-002",
    "ANC-CONTENT-002"
  ],
  "provenance": {
    "batch_id": "BATCH-20260322-10R1",
    "models_used": [
      "Codex"
    ],
    "canon_version": "0.1.0",
    "seed": "20260322-10"
  },
  "status": "draft"
}
